<?xml version="1.0" encoding="UTF-8"?>
 <room xmlns:xsi="http://www.w3.org/2001/XMLSchema-instance" 
 xsi:noNamespaceSchemaLocation="file:/home/tom/Opendungeons/opendungeons/xsd/RoomScheme.xsd">
<roomType>Forge</roomType>
<meshName>Forge</meshName>
<color>2</color>
<numTiles>16</numTiles>
<point>
<tileX>9</tileX>
<tileY>9</tileY>
</point>
<point>
<tileX>9</tileX>
<tileY>10</tileY>
</point>
<point>
<tileX>9</tileX>
<tileY>11</tileY>
</point>
<point>
<tileX>9</tileX>
<tileY>12</tileY>
</point>
<point>
<tileX>10</tileX>
<tileY>9</tileY>
</point>
<point>
<tileX>10</tileX>
<tileY>10</tileY>
</point>
<point>
<tileX>10</tileX>
<tileY>11</tileY>
</point>
<point>
<tileX>10</tileX>
<tileY>12</tileY>
</point>
<point>
<tileX>11</tileX>
<tileY>9</tileY>
</point>
<point>
<tileX>11</tileX>
<tileY>10</tileY>
</point>
<point>
<tileX>11</tileX>
<tileY>11</tileY>
</point>
<point>
<tileX>11</tileX>
<tileY>12</tileY>
</point>
<point>
<tileX>12</tileX>
<tileY>9</tileY>
</point>
<point>
<tileX>12</tileX>
<tileY>10</tileY>
</point>
<point>
<tileX>12</tileX>
<tileY>11</tileY>
</point>
<point>
<tileX>12</tileX>
<tileY>12</tileY>
</point>
</room>
