<?xml version="1.0" encoding="UTF-8"?>
 <room xmlns:xsi="http://www.w3.org/2001/XMLSchema-instance" 
 xsi:noNamespaceSchemaLocation="file:/home/tom/Opendungeons/opendungeons/xsd/RoomScheme.xsd">
<roomType>Quarters</roomType>
<meshName>Quarters</meshName>
<color>1</color>
<numTiles>2</numTiles>
<pair>
<tileX>-5</tileX>
<tileY>13</tileY>
</pair>
<pair>
<tileX>-6</tileX>
<tileY>13</tileY>
</pair>
</room>
